,X,Y,OBJECTID,COD_SIG_ESTACIONAMENTO,COD_SIG_PROPOSTA,FREGUESIA,MORADA,MORADA_DETALHE,LOCALIZACAO,FOTO,TIPO_ESTACIONAMENTO,NUM_SUPORTES,MODELO,CAPACIDADE,FONTE_LEVANTAMENTO,BALIZADORES,DOMINIALIDADE,DATA_INSTALACAO,SV_TIPO,SV_NUM_SERIE,ESTACIONAMENTO_ESTADO,EST_ESTADO_OBS,OBS,DEPM_VALIDACAO,CTRL_EDICOES,COBERTO,COD_SIG,IDTIPO,SE_ANNO_CAD_DATA,GlobalID,_lat_,_lng_,_type_,_name_
618,-9.14198188967546,38.7274277424102,619,1217,96423.0,ARROIOS,"R Gomes Freire, 162",Primeiro lugar de estacionamento após o lugar de motociclos existente,Lugar estacionamento automóvel,K:\1 Planeamento\0_REDES\Estacionamento MaaS DOCKLESS\Fotos\existentes\1217.jpg,HOTSPOT,2.0,Sheffield Standard,9.0,DEPM,4.0,,2020/10/26 00:00:00+00,,,,,Retirado RESOPRE - EMEL,2020/10/26 00:00:00+00,2020/11/02 00:00:00+00,NÃO,26813,9207,,70b8a15d-2af1-42a7-a743-d15624ee5aa2,38.7274277424102,-9.14198188967546,HOTSPOT,"R Gomes Freire, 162 - Primeiro lugar de estacionamento após o lugar de motociclos existente - Lugar estacionamento automóvel"
619,-9.14070457068138,38.7299255345141,620,1218,114074.0,ARROIOS,R Escola Medicina Veterinária 2,"Último lugar estacionamento tarifado, do lado esquerdo da via, antes da passadeira",Lugar estacionamento automóvel,K:\1 Planeamento\0_REDES\Estacionamento MaaS DOCKLESS\Fotos\existentes\1218.jpg,HOTSPOT,4.0,Sheffield Standard,18.0,DEPM,4.0,,2020/10/26 00:00:00+00,,,,,<Null>,2020/10/26 00:00:00+00,2020/11/02 00:00:00+00,NÃO,26814,9207,,f48d9112-f934-4450-b91f-4f7bbcb54b7c,38.7299255345141,-9.14070457068138,HOTSPOT,"R Escola Medicina Veterinária 2 - Último lugar estacionamento tarifado, do lado esquerdo da via, antes da passadeira - Lugar estacionamento automóvel"
620,-9.14050784502405,38.7306390088799,621,1219,86488.0,ARROIOS,R Alexandre Braga 33,Primeiro lugar de estacionamento tarifado do lado esquerdo da via,Lugar estacionamento automóvel,K:\1 Planeamento\0_REDES\Estacionamento MaaS DOCKLESS\Fotos\existentes\1219.jpg,BICICLETA,4.0,Sheffield Standard,8.0,DEPM,4.0,,2020/10/26 00:00:00+00,,,,,Retirado RESOPRE - EMEL,2020/10/26 00:00:00+00,2020/11/02 00:00:00+00,NÃO,26815,9207,,7e16e81d-277f-416b-9bb2-b13620fc57a1,38.7306390088799,-9.14050784502405,BICICLETA,R Alexandre Braga 33 - Primeiro lugar de estacionamento tarifado do lado esquerdo da via - Lugar estacionamento automóvel
621,-9.12875799788876,38.7212294949583,622,1440,156539.0,SÃO VICENTE,"Rua dos Sapadores, 149 ","Escola Básica Natália Correia, local no enquadramento do pedido Direção Escolas Nuno Gonçalves, a  escola não têm pátios interiores, sendo este lugar o mais próximo da entrada ",Lugar estacionamento automóvel,K:\1 Planeamento\0_REDES\Estacionamento MaaS DOCKLESS\Fotos\156539.jpg,BICICLETA,4.0,Sheffield Standard,8.0,Dir Escolas Nuno Gonçalves,,Público,2021/05/05 00:00:00+00,,,,,<Null>,2021/05/06 00:00:00+00,2021/05/06 00:00:00+00,NÃO,27021,9207,,39769b39-7ae5-4d51-98e4-df8dfb6bbce9,38.7212294949583,-9.12875799788876,BICICLETA,"Rua dos Sapadores, 149  - Escola Básica Natália Correia, local no enquadramento do pedido Direção Escolas Nuno Gonçalves, a  escola não têm pátios interiores, sendo este lugar o mais próximo da entrada  - Lugar estacionamento automóvel"
622,-9.15245040773726,38.7054237605057,623,1441,1207.0,ESTRELA,R de Cintura do Porto de Lisboa junto Ciclovia e frente Jazzy dance studios,Junto ao muro,Via,K:\1 Planeamento\0_REDES\Estacionamento MaaS DOCKLESS\Fotos\1207.jpg,HOTSPOT,2.0,Sheffield Standard,9.0,DEPM,,Público,2021/05/05 00:00:00+00,,,,,<Null>,2021/05/06 00:00:00+00,2021/05/06 00:00:00+00,NÃO,27022,9207,,5da19a77-c7f9-486b-bd2f-52a9a265ce9e,38.7054237605057,-9.15245040773726,HOTSPOT,R de Cintura do Porto de Lisboa junto Ciclovia e frente Jazzy dance studios - Junto ao muro - Via
623,-9.20068032382598,38.6946356218609,624,1442,1220.0,BELÉM,Av Brasília ao lado ciclovia junto às instalações da  Doca de Belém,No primeiro lugar após a passadeira,Lugar estacionamento automóvel,K:\1 Planeamento\0_REDES\Estacionamento MaaS DOCKLESS\Fotos\1220.jpg,HOTSPOT,2.0,Sheffield Standard,9.0,DEPM,,Público,2021/05/05 00:00:00+00,,,,,<Null>,2021/05/06 00:00:00+00,2021/05/06 00:00:00+00,NÃO,27023,9207,,df7dc28a-5cb4-4dcd-872d-39433c0c8c87,38.6946356218609,-9.20068032382598,HOTSPOT,Av Brasília ao lado ciclovia junto às instalações da  Doca de Belém - No primeiro lugar após a passadeira - Lugar estacionamento automóvel
624,-9.20294468380647,38.6951739787788,625,1443,1221.0,BELÉM,Av Brasília 1º lugar na zona de parque em frente edifício da Doca de Bélem,No primeiro lugar de estacionamento após o passeio,Lugar estacionamento automóvel,K:\1 Planeamento\0_REDES\Estacionamento MaaS DOCKLESS\Fotos\1221.jpg,HOTSPOT,2.0,Sheffield Standard,9.0,DEPM,,Público,2021/05/05 00:00:00+00,,,,,<Null>,2021/05/06 00:00:00+00,2021/05/06 00:00:00+00,NÃO,27024,9207,,24e48fee-22d4-4915-bf72-31a8721208e7,38.6951739787788,-9.20294468380647,HOTSPOT,Av Brasília 1º lugar na zona de parque em frente edifício da Doca de Bélem - No primeiro lugar de estacionamento após o passeio - Lugar estacionamento automóvel
625,-9.2123592265117,38.6951904873453,626,1444,1238.0,BELÉM,"R da Praia do Bom Sucesso, entrada da creche",No primeiro lugar de estacionamento,Lugar estacionamento automóvel,K:\1 Planeamento\0_REDES\Estacionamento MaaS DOCKLESS\Fotos\1238.jpg,BICICLETA,3.0,Sheffield Standard,6.0,DEPM,,Público,2021/05/05 00:00:00+00,,,,,AP Email Vereador,2021/05/06 00:00:00+00,2021/05/06 00:00:00+00,NÃO,27025,9207,,154dba70-3134-4ef4-a730-d7310ca0833c,38.6951904873453,-9.2123592265117,BICICLETA,"R da Praia do Bom Sucesso, entrada da creche - No primeiro lugar de estacionamento - Lugar estacionamento automóvel"
626,-9.1801691223847,38.7531178345664,627,1445,1269.0,SÃO DOMINGOS DE BENFICA,"R João de Freitas Branco,30",Lugar de estacionamento isolado  após garagem ,Lugar estacionamento automóvel,K:\1 Planeamento\0_REDES\Estacionamento MaaS DOCKLESS\Fotos\1269.jpg,HOTSPOT,2.0,Sheffield Standard,9.0,DEPM,,Público,2021/05/05 00:00:00+00,,,,,<Null>,2021/05/06 00:00:00+00,2021/05/06 00:00:00+00,NÃO,27026,9207,,eeffd3e4-3c6b-4bfa-90e5-e4042fa935cb,38.7531178345664,-9.1801691223847,HOTSPOT,"R João de Freitas Branco,30 - Lugar de estacionamento isolado  após garagem  - Lugar estacionamento automóvel"
627,-9.12586883267871,38.7121483940791,628,1446,1440.0,SANTA MARIA MAIOR,"R do Jardim do Tabaco, 34 ( ISPA - Instituto Universitário de Ciências Psicológicas, Sociais e da Vida)",Início do estacionamento destinado a motociclos,Lugar estacionamento motociclo,K:\1 Planeamento\0_REDES\Estacionamento MaaS DOCKLESS\Fotos\1440.jpg,BICICLETA,4.0,Sheffield Standard,8.0,DEPM,,Público,2021/05/05 00:00:00+00,,,,,No exterior por inexistência de espaço interior. Preciso reconverter pintura pavimento.,2021/05/06 00:00:00+00,2021/05/06 00:00:00+00,NÃO,27027,9207,,265de51a-20f1-4aee-9448-2f8537b71c7c,38.7121483940791,-9.12586883267871,BICICLETA,"R do Jardim do Tabaco, 34 ( ISPA - Instituto Universitário de Ciências Psicológicas, Sociais e da Vida) - Início do estacionamento destinado a motociclos - Lugar estacionamento motociclo"
628,-9.18050557469629,38.76934616525,629,1447,1882.0,CARNIDE,R  António Champalimaud lote 1,Primeiro lugar de estacinamento após passeio da zona de entrada lote 1,Lugar estacionamento automóvel,K:\1 Planeamento\0_REDES\Estacionamento MaaS DOCKLESS\Fotos\1882.jpg,HOTSPOT,2.0,Sheffield Standard,9.0,DEPM,,Público,2021/05/05 00:00:00+00,,,,, Pedido LISPOLIS,2021/05/06 00:00:00+00,2021/05/06 00:00:00+00,NÃO,27028,9207,,cce3f186-c0ce-43d1-9d77-790df312c981,38.76934616525,-9.18050557469629,HOTSPOT,R  António Champalimaud lote 1 - Primeiro lugar de estacinamento após passeio da zona de entrada lote 1 - Lugar estacionamento automóvel
629,-9.15089142647742,38.7196687909582,630,1448,2575.0,SANTO ANTÓNIO,R Nova de São Mamede 76,Raia entre entrada de garagem e passadeira,Via,K:\1 Planeamento\0_REDES\Estacionamento MaaS DOCKLESS\Fotos\2575.jpg,BICICLETA,4.0,Sheffield Standard,8.0,Municipe,,Público,2021/05/05 00:00:00+00,,,,,<Null>,2021/05/06 00:00:00+00,2021/05/06 00:00:00+00,NÃO,27029,9207,,2e7fb292-c248-4112-9772-2deed16e91f2,38.7196687909582,-9.15089142647742,BICICLETA,R Nova de São Mamede 76 - Raia entre entrada de garagem e passadeira - Via
630,-9.16679680915016,38.7135694733674,631,1449,,CAMPO DE OURIQUE,"Rua Professor Gomes Teixeira, 5",,Lugar estacionamento automóvel,,BICICLETA,4.0,Sheffield estilizado,8.0,DEPM,0.0,Público,1970/01/01 00:00:00+00,,,,,,2021/05/12 00:00:00+00,2021/05/12 00:00:00+00,NÃO,27030,9207,,b8579b4c-4ec0-4610-b7b3-56f2d8966723,38.7135694733674,-9.16679680915016,BICICLETA,"Rua Professor Gomes Teixeira, 5 - nan - Lugar estacionamento automóvel"
631,-9.12608789404726,38.7556714513173,632,1450,,MARVILA,"Azinhaga da Bela Vista, 2B",Colégio Valsassina,,,BICICLETA,1.0,Entorta rodas,5.0,DEPM,0.0,Privado,1970/01/01 00:00:00+00,,,,,,1970/01/01 00:00:00+00,2021/05/12 00:00:00+00,NÃO,27031,9207,,8f9a12cd-b20e-4061-a11c-e2e29dbecba9,38.7556714513173,-9.12608789404726,BICICLETA,"Azinhaga da Bela Vista, 2B - Colégio Valsassina - nan"
632,-9.15598486695187,38.7502524350383,633,1451,,ALVALADE,"Rua Prof.ª Teresa Ambrósio, Fac. Medicina Dentária",Do lado esquerda após entrada no parque,Lugar estacionamento automóvel,,BICICLETA,5.0,Sheffield Standard,10.0,DEPM,0.0,Privado,1970/01/01 00:00:00+00,,,,,,2021/05/13 00:00:00+00,2021/05/13 00:00:00+00,NÃO,27032,9207,,3e9b5c92-95a4-460f-97d3-d96c6757bc37,38.7502524350383,-9.15598486695187,BICICLETA,"Rua Prof.ª Teresa Ambrósio, Fac. Medicina Dentária - Do lado esquerda após entrada no parque - Lugar estacionamento automóvel"
633,-9.16163377708897,38.733269670862,634,675,,CAMPOLIDE,"Universidade Nova, interior do Campus de Campolide",,Passeio,K:\1 Planeamento\0_REDES\Estacionamento MaaS DOCKLESS\Fotos\existentes\675.jpg,BICICLETA,,Sheffield Standard,,DEPM,0.0,Privado,1970/01/01 00:00:00+00,,,,,,2019/09/04 00:00:00+00,2020/01/08 00:00:00+00,NÃO,26448,9207,,83c941d1-368a-42f8-adee-29ed666a1266,38.733269670862,-9.16163377708897,BICICLETA,"Universidade Nova, interior do Campus de Campolide - nan - Passeio"
634,-9.16150762128373,38.7331296896428,635,676,,CAMPOLIDE,"Universidade Nova, interior do Campus de Campolide",,Passeio,K:\1 Planeamento\0_REDES\Estacionamento MaaS DOCKLESS\Fotos\existentes\676.jpg,BICICLETA,,Sheffield Standard,,DEPM,0.0,Privado,1970/01/01 00:00:00+00,,,,,,2019/09/04 00:00:00+00,2020/01/08 00:00:00+00,NÃO,26449,9207,,1f2b396d-b65c-48c0-b4df-f4489c67a2d7,38.7331296896428,-9.16150762128373,BICICLETA,"Universidade Nova, interior do Campus de Campolide - nan - Passeio"
635,-9.12982922449202,38.7618135118652,636,677,121.0,ALVALADE,Av Almirante Gago Coutinho na esquina com a Rua Quinta da Graça,Entre caldeiras de árvores,Passeio,K:\1 Planeamento\0_REDES\Estacionamento MaaS DOCKLESS\Fotos\existentes\677.jpg,HOTSPOT,2.0,Sheffield Standard,9.0,DEPM,0.0,Público,2019/11/26 00:00:00+00,,,,,,2019/11/26 00:00:00+00,2021/01/29 00:00:00+00,NÃO,26450,9207,,7407ad10-1cca-4dab-8002-a4363f346587,38.7618135118652,-9.12982922449202,HOTSPOT,Av Almirante Gago Coutinho na esquina com a Rua Quinta da Graça - Entre caldeiras de árvores - Passeio
636,-9.15046907276682,38.723920755182,637,678,874.0,SANTO ANTÓNIO,"R Duque de Palmela, em frente ao 35C",<Null>,Passeio,K:\1 Planeamento\0_REDES\Estacionamento MaaS DOCKLESS\Fotos\existentes\678.jpg,HOTSPOT,2.0,Sheffield Standard,4.0,DEPM,0.0,Público,2019/11/25 00:00:00+00,,,,,,1970/01/01 00:00:00+00,2020/01/08 00:00:00+00,NÃO,26451,9207,,3fa5edc2-6277-4a29-9d1c-0065f58f58e4,38.723920755182,-9.15046907276682,HOTSPOT,"R Duque de Palmela, em frente ao 35C - <Null> - Passeio"
637,-9.15427046996136,38.7203736881393,638,679,283.0,SANTO ANTÓNIO,Largo do Rato em frente ao 4,Entre o quiosque e árvore,Passeio,K:\1 Planeamento\0_REDES\Estacionamento MaaS DOCKLESS\Fotos\existentes\679.jpg,BICICLETA,2.0,Sheffield Standard,4.0,DEPM,0.0,Público,2019/11/23 00:00:00+00,,,,,,1970/01/01 00:00:00+00,2021/02/05 00:00:00+00,NÃO,26452,9207,,898df02a-fcdc-45e6-88aa-8097fc87f356,38.7203736881393,-9.15427046996136,BICICLETA,Largo do Rato em frente ao 4 - Entre o quiosque e árvore - Passeio
638,-9.14403398044925,38.7514138745965,639,680,337.0,ALVALADE,"R Alberto de Oliveira, na entrada Quadrum Galeria de Arte",Na lateral ao estacionamento existente,Via,K:\1 Planeamento\0_REDES\Estacionamento MaaS DOCKLESS\Fotos\existentes\680.jpg,BICICLETA,2.0,Sheffield Standard,4.0,DEPM,1.0,Público,2019/11/29 00:00:00+00,,,,,,2019/11/29 00:00:00+00,2021/02/03 00:00:00+00,NÃO,26453,9207,,8ce06cf9-e850-4eae-98f7-82cc9f7af822,38.7514138745965,-9.14403398044925,BICICLETA,"R Alberto de Oliveira, na entrada Quadrum Galeria de Arte - Na lateral ao estacionamento existente - Via"
639,-9.15058050698117,38.7082198773009,640,681,42.0,MISERICÓRDIA,R do Instituto Industrial em frente ao 7,"Na zona pedonal, entre o segundo e terceiro canteiros a contar de Norte",Passeio,K:\1 Planeamento\0_REDES\Estacionamento MaaS DOCKLESS\Fotos\existentes\681.jpg,HOTSPOT,2.0,Sheffield Standard,9.0,DEPM,0.0,Público,2019/02/15 00:00:00+00,,,,,,2019/02/15 00:00:00+00,2021/02/03 00:00:00+00,NÃO,26454,9207,,09a17b7d-0a74-4615-896b-5bea4a53e382,38.7082198773009,-9.15058050698117,HOTSPOT,"R do Instituto Industrial em frente ao 7 - Na zona pedonal, entre o segundo e terceiro canteiros a contar de Norte - Passeio"
640,-9.15057051232533,38.7079787980426,641,682,43.0,MISERICÓRDIA,R do Instituto Industrial em frente ao 7,"Na zona pedonal, entre os canteiros a Sul",Passeio,K:\1 Planeamento\0_REDES\Estacionamento MaaS DOCKLESS\Fotos\existentes\682.jpg,HOTSPOT,2.0,Sheffield Standard,9.0,DEPM,0.0,Público,2019/02/15 00:00:00+00,,,,,,2019/02/15 00:00:00+00,2021/02/03 00:00:00+00,NÃO,26455,9207,,0e0111d4-d484-4826-a25b-ab4ae858d0a2,38.7079787980426,-9.15057051232533,HOTSPOT,"R do Instituto Industrial em frente ao 7 - Na zona pedonal, entre os canteiros a Sul - Passeio"
641,-9.13575265439008,38.7189111626087,642,683,301.0,SANTA MARIA MAIOR,"R da Palma, em frente ao n.º 243",Lugar de estacionamento depois da estação GIRA,Lugar estacionamento automóvel,K:\1 Planeamento\0_REDES\Estacionamento MaaS DOCKLESS\Fotos\existentes\683.jpg,HOTSPOT,2.0,Sheffield Standard,9.0,DEPM,,Público,2019/01/09 00:00:00+00,,,,,,2019/01/09 00:00:00+00,2021/02/05 00:00:00+00,NÃO,26456,9207,,dca17f49-af25-4cf1-b033-bd8314d6b6ae,38.7189111626087,-9.13575265439008,HOTSPOT,"R da Palma, em frente ao n.º 243 - Lugar de estacionamento depois da estação GIRA - Lugar estacionamento automóvel"
642,-9.13554754206126,38.7193499229199,643,684,89.0,SANTA MARIA MAIOR,"R da Palma, frente ao 278",Em frente ao supermecado Minipreço,Passeio,K:\1 Planeamento\0_REDES\Estacionamento MaaS DOCKLESS\Fotos\existentes\684.jpg,BICICLETA,2.0,Sheffield Standard,4.0,DEPM,0.0,Público,2019/01/30 00:00:00+00,,,,,,1970/01/01 00:00:00+00,2021/02/05 00:00:00+00,NÃO,26457,9207,,62779cdb-e486-48bd-87e1-cef80a786aed,38.7193499229199,-9.13554754206126,BICICLETA,"R da Palma, frente ao 278 - Em frente ao supermecado Minipreço - Passeio"
643,-9.13930701847474,38.7446114220835,644,688,209.0,AREEIRO,Av Roma em frente ao 26 (gaveto),<Null>,Passeio,K:\1 Planeamento\0_REDES\Estacionamento MaaS DOCKLESS\Fotos\existentes\688.jpg,BICICLETA,3.0,Sheffield Standard,6.0,DEPM,0.0,Público,2019/02/13 00:00:00+00,,,,,,1970/01/01 00:00:00+00,2021/02/03 00:00:00+00,NÃO,26458,9207,,b846d058-ee8d-42ac-b678-211f0dc585fb,38.7446114220835,-9.13930701847474,BICICLETA,Av Roma em frente ao 26 (gaveto) - <Null> - Passeio
644,-9.14378626641638,38.7547246533633,645,689,802.0,ALVALADE,R Luís Augusto Palmeirim em frente ao 13,Raia,Via,K:\1 Planeamento\0_REDES\Estacionamento MaaS DOCKLESS\Fotos\existentes\689.jpg,HOTSPOT,2.0,Sheffield Standard,9.0,DEPM,3.0,Público,2019/04/05 00:00:00+00,,,,,,2019/04/05 00:00:00+00,2021/02/03 00:00:00+00,NÃO,26459,9207,,cf0a8b72-3f3f-4b10-9b14-d73c5a98f8b3,38.7547246533633,-9.14378626641638,HOTSPOT,R Luís Augusto Palmeirim em frente ao 13 - Raia - Via
645,-9.14287951505345,38.7549287135409,646,690,803.0,ALVALADE,R Acácio de Paiva em frente ao 13c,Raia,Via,K:\1 Planeamento\0_REDES\Estacionamento MaaS DOCKLESS\Fotos\existentes\690.jpg,HOTSPOT,3.0,Sheffield Standard,6.0,DEPM,3.0,Público,2019/04/05 00:00:00+00,,,,,,2019/04/05 00:00:00+00,2021/02/03 00:00:00+00,NÃO,26460,9207,,d9377a13-8fc8-43c2-a06b-ee7b5de114f2,38.7549287135409,-9.14287951505345,HOTSPOT,R Acácio de Paiva em frente ao 13c - Raia - Via
646,-9.14112809489683,38.754878450925,647,691,811.0,ALVALADE,R José Duro em frente ao 25,Raia,Via,K:\1 Planeamento\0_REDES\Estacionamento MaaS DOCKLESS\Fotos\existentes\691.jpg,HOTSPOT,4.0,Sheffield Standard,13.0,DEPM,3.0,Público,2019/04/30 00:00:00+00,,,,,,2019/04/30 00:00:00+00,2021/02/03 00:00:00+00,NÃO,26461,9207,,fdd22176-1f35-46ef-9929-1312d1b0bb9e,38.754878450925,-9.14112809489683,HOTSPOT,R José Duro em frente ao 25 - Raia - Via
647,-9.13525816955542,38.7314228097776,648,882,150320.0,ARROIOS,"R António Pedro, 38",Primeiro lugar de estacionamento tarifado após a passadeira,Lugar estacionamento automóvel,K:\1 Planeamento\0_REDES\Estacionamento MaaS DOCKLESS\Fotos\existentes\882.jpg,HOTSPOT,2.0,Sheffield Standard,9.0,DEPM,,Público,2020/09/01 00:00:00+00,,,,,Retirado RESOPRE - EMEL,2020/09/01 00:00:00+00,2020/09/03 00:00:00+00,NÃO,26642,9207,,2a47550c-0715-4bc9-b0e4-a35dc2f8cfe8,38.7314228097776,-9.13525816955542,HOTSPOT,"R António Pedro, 38 - Primeiro lugar de estacionamento tarifado após a passadeira - Lugar estacionamento automóvel"
648,-9.13686386859991,38.7304052610543,649,883,101241.0,ARROIOS,R Passos Manuel 108a,Lugar tarifado antes do lugar de estacionamento para motociclos,Lugar estacionamento automóvel,K:\1 Planeamento\0_REDES\Estacionamento MaaS DOCKLESS\Fotos\existentes\883.jpg,HOTSPOT,4.0,Sheffield Standard,13.0,DEPM,,Público,2020/09/01 00:00:00+00,,,,,<Null>,2020/09/01 00:00:00+00,2020/09/03 00:00:00+00,NÃO,26643,9207,,81ea90e6-b60d-4cd9-8a9f-3c6339baea16,38.7304052610543,-9.13686386859991,HOTSPOT,R Passos Manuel 108a - Lugar tarifado antes do lugar de estacionamento para motociclos - Lugar estacionamento automóvel
649,-9.13681701247467,38.7286582378347,650,884,101163.0,ARROIOS,R Passos Manuel 64a,Lugar tarifado após lugar de estacionamento para motociclos,Lugar estacionamento automóvel,K:\1 Planeamento\0_REDES\Estacionamento MaaS DOCKLESS\Fotos\existentes\884.jpg,BICICLETA,4.0,Sheffield Standard,8.0,DEPM,,Público,2020/09/01 00:00:00+00,,,,,<Null>,2020/09/01 00:00:00+00,2020/09/03 00:00:00+00,NÃO,26644,9207,,6182718e-b69f-4f33-81e5-be0d9cadc2ad,38.7286582378347,-9.13681701247467,BICICLETA,R Passos Manuel 64a - Lugar tarifado após lugar de estacionamento para motociclos - Lugar estacionamento automóvel
650,-9.13677686047644,38.7271609592925,651,885,101109.0,ARROIOS,R Passos Manuel 2a/2c,Lugar tarifado após lugar de estacionamento para motociclos,Lugar estacionamento automóvel,K:\1 Planeamento\0_REDES\Estacionamento MaaS DOCKLESS\Fotos\existentes\885.jpg,HOTSPOT,2.0,Sheffield Standard,9.0,DEPM,,Público,2020/09/01 00:00:00+00,,,,,Retirado RESOPRE - EMEL,2020/09/01 00:00:00+00,2020/09/03 00:00:00+00,NÃO,26645,9207,,f723b8d7-7105-4f93-a90c-76b46467dc44,38.7271609592925,-9.13677686047644,HOTSPOT,R Passos Manuel 2a/2c - Lugar tarifado após lugar de estacionamento para motociclos - Lugar estacionamento automóvel
651,-9.13761380286033,38.7287487169733,652,886,150574.0,ARROIOS,R José Estevão 33,Lugar tarifado isolado após lugares reservados a Hotel,Lugar estacionamento automóvel,K:\1 Planeamento\0_REDES\Estacionamento MaaS DOCKLESS\Fotos\existentes\886.jpg,HOTSPOT,2.0,Sheffield Standard,9.0,DEPM,,Público,2020/09/01 00:00:00+00,,,,,Retirado RESOPRE - EMEL,2020/09/01 00:00:00+00,2020/09/03 00:00:00+00,NÃO,26646,9207,,cd462d59-7699-457f-9a3c-41e0cd9ef9e9,38.7287487169733,-9.13761380286033,HOTSPOT,R José Estevão 33 - Lugar tarifado isolado após lugares reservados a Hotel - Lugar estacionamento automóvel
652,-9.1425474249609,38.7270239417323,653,887,89931.0,ARROIOS,"R Bernardino Ribeiro, 16",Primeiro lugar de estacionamento após a passadeira,Lugar estacionamento automóvel,K:\1 Planeamento\0_REDES\Estacionamento MaaS DOCKLESS\Fotos\existentes\887.jpg,HOTSPOT,2.0,Sheffield Standard,9.0,DEPM,,Público,2020/09/01 00:00:00+00,,,,,Retirado RESOPRE - EMEL,2020/09/01 00:00:00+00,2020/09/03 00:00:00+00,NÃO,26647,9207,,462b6fee-197e-4008-88e1-39a81ea785c1,38.7270239417323,-9.1425474249609,HOTSPOT,"R Bernardino Ribeiro, 16 - Primeiro lugar de estacionamento após a passadeira - Lugar estacionamento automóvel"
653,-9.14345351606209,38.7263578147226,654,888,89913.0,SANTO ANTÓNIO,"R Bernardino Ribeiro, 28",Último lugar de estacionamento antes do cruzamento,Lugar estacionamento automóvel,K:\1 Planeamento\0_REDES\Estacionamento MaaS DOCKLESS\Fotos\existentes\888.jpg,HOTSPOT,2.0,Sheffield Standard,9.0,DEPM,,Público,2020/09/01 00:00:00+00,,,,,Retirado RESOPRE - EMEL,2020/09/01 00:00:00+00,2020/09/03 00:00:00+00,NÃO,26648,9207,,0a797d11-1d7c-4ff7-b104-97a74aa73a80,38.7263578147226,-9.14345351606209,HOTSPOT,"R Bernardino Ribeiro, 28 - Último lugar de estacionamento antes do cruzamento - Lugar estacionamento automóvel"
654,-9.13765843924847,38.7304388001094,655,889,150415.0,ARROIOS,R José Estêvão 117,Primeiro lugar de estacionamento tarifado após passadeira,Lugar estacionamento automóvel,K:\1 Planeamento\0_REDES\Estacionamento MaaS DOCKLESS\Fotos\existentes\889.jpg,BICICLETA,4.0,Sheffield Standard,8.0,DEPM,,Público,2020/09/01 00:00:00+00,,,,,Retirado RESOPRE - EMEL,2020/09/01 00:00:00+00,2020/09/03 00:00:00+00,NÃO,26649,9207,,489fe837-2405-4c8b-8264-452cad5b2f3b,38.7304388001094,-9.13765843924847,BICICLETA,R José Estêvão 117 - Primeiro lugar de estacionamento tarifado após passadeira - Lugar estacionamento automóvel
655,-9.13958601274412,38.7307529592398,656,890,86502.0,ARROIOS,R Alexandre Braga 20,Último lugar tarifado antes entrada garagem,Lugar estacionamento automóvel,K:\1 Planeamento\0_REDES\Estacionamento MaaS DOCKLESS\Fotos\existentes\890.jpg,HOTSPOT,2.0,Sheffield Standard,9.0,DEPM,,Público,2020/09/01 00:00:00+00,,,,,Retirado RESOPRE - EMEL,2020/09/01 00:00:00+00,2020/09/03 00:00:00+00,NÃO,26650,9207,,7c633868-0285-45b7-8dbd-bd993df0a158,38.7307529592398,-9.13958601274412,HOTSPOT,R Alexandre Braga 20 - Último lugar tarifado antes entrada garagem - Lugar estacionamento automóvel
656,-9.14052526425574,38.7292749969026,657,891,96224.0,ARROIOS,"R General Garcia Rosado 1, do lado oposto da via",Primeiro estacionamento tarifado do lado esquerdo da via antes do cruzamento com R Dona Estefânia e do olado oposto de um lugar de estacionamento para motociclos,Lugar estacionamento automóvel,K:\1 Planeamento\0_REDES\Estacionamento MaaS DOCKLESS\Fotos\existentes\891.jpg,HOTSPOT,2.0,Sheffield Standard,9.0,DEPM,,Público,2020/09/01 00:00:00+00,,,,,Retirado RESOPRE - EMEL,2020/09/01 00:00:00+00,2020/09/03 00:00:00+00,NÃO,26651,9207,,288384e6-b52f-4668-a38c-7a4ad9c452a8,38.7292749969026,-9.14052526425574,HOTSPOT,"R General Garcia Rosado 1, do lado oposto da via - Primeiro estacionamento tarifado do lado esquerdo da via antes do cruzamento com R Dona Estefânia e do olado oposto de um lugar de estacionamento para motociclos - Lugar estacionamento automóvel"
657,-9.14038313281148,38.7221625615629,658,892,83453.0,ARROIOS,"Campo Mártires da Pátria, 50 (lado oposto da via)",Primeiro lugar de estacionamento  ao lado do jardim,Lugar estacionamento automóvel,K:\1 Planeamento\0_REDES\Estacionamento MaaS DOCKLESS\Fotos\existentes\892.jpg,HOTSPOT,2.0,Sheffield Standard,9.0,DEPM,,Público,2020/09/01 00:00:00+00,,,,,Retirado RESOPRE - EMEL,2020/09/01 00:00:00+00,2020/09/03 00:00:00+00,NÃO,26652,9207,,3fbfca17-827f-4ece-bf92-1aa847c5adf3,38.7221625615629,-9.14038313281148,HOTSPOT,"Campo Mártires da Pátria, 50 (lado oposto da via) - Primeiro lugar de estacionamento  ao lado do jardim - Lugar estacionamento automóvel"
658,-9.10782032306299,38.7303320406031,659,1220,707.0,BEATO,R do Grilo em frente ao 116A do lado oposto da via.,<Null>,Lugar estacionamento automóvel,K:\1 Planeamento\0_REDES\Estacionamento MaaS DOCKLESS\Fotos\existentes\1220.jpg,HOTSPOT,2.0,Sheffield Standard,9.0,DEPM,4.0,Público,2020/10/26 00:00:00+00,,,,,<Null>,2020/10/26 00:00:00+00,2020/11/02 00:00:00+00,NÃO,26816,9207,,ad62bf99-ab7a-47a5-9fd1-4504817a5603,38.7303320406031,-9.10782032306299,HOTSPOT,R do Grilo em frente ao 116A do lado oposto da via. - <Null> - Lugar estacionamento automóvel
659,-9.19447286010982,38.7497471191428,660,1221,612.0,BENFICA,Estrada de Benfica frente EB Pedro de Santarém,<Null>,Lugar estacionamento automóvel,K:\1 Planeamento\0_REDES\Estacionamento MaaS DOCKLESS\Fotos\existentes\1221.jpg,BICICLETA,4.0,Sheffield Standard,8.0,DEPM,,,2020/10/26 00:00:00+00,,,,,<Null>,2020/10/26 00:00:00+00,2020/11/02 00:00:00+00,NÃO,26817,9207,,4fcfb819-266e-446e-b074-46b22307b03f,38.7497471191428,-9.19447286010982,BICICLETA,Estrada de Benfica frente EB Pedro de Santarém - <Null> - Lugar estacionamento automóvel
660,-9.19594981799769,38.7500101461528,661,1222,613.0,BENFICA,Estrada de Benfica frente  EB23 Quinta Marrocos,<Null>,Lugar estacionamento automóvel,K:\1 Planeamento\0_REDES\Estacionamento MaaS DOCKLESS\Fotos\existentes\1222.jpg,HOTSPOT,2.0,Sheffield Standard,9.0,DEPM,4.0,,2020/10/26 00:00:00+00,,,,,<Null>,2020/10/26 00:00:00+00,2020/11/02 00:00:00+00,NÃO,26818,9207,,afdeff84-64c9-4f37-9286-3d2da435dfb4,38.7500101461528,-9.19594981799769,HOTSPOT,Estrada de Benfica frente  EB23 Quinta Marrocos - <Null> - Lugar estacionamento automóvel
