,X,Y,OBJECTID,COD_SIG,IDTIPO,MORADA,DESIGNACAO,TIPOLOGIA,SE_ANNO_CAD_DATA,GlobalID,_lat_,_lng_,_type_,_name_
0,-9.14606908947091,38.7099629258795,1,4904,4,Travessa da Laranjeira,Fontanário na Travessa da Laranjeira,Fontanário,,2eb707a7-8791-4e39-9db9-cc13dcbf3bc2,0.0,0.0,,
1,-9.2146783531818,38.7156940855157,2,4007,4,Rua Sam Levy(antigo Troço da Estrada de Caselas),Fontanário na Rua Sam Levy,Fontanário,,3f50e050-02ad-4b73-ba53-9fc3b57bcce7,0.0,0.0,,
2,-9.12813441167303,38.7113079999168,3,4703,4,Largo do Chafariz de Dentro,Reservatório do Chafariz de Dentro,Reservatório,,49e8b3e0-efad-4be5-910a-ed24faa84341,0.0,0.0,,
3,-9.14676193579502,38.7089222089291,4,4905,4,Largo de Santo Antoninho,Fontanário no Largo de Santo Antoninho,Fontanário,,98b49bb4-9743-4c8b-8c32-b339a253a7cf,0.0,0.0,,
4,-9.15448657138105,38.7303708929669,5,5002,4,Alameda Cardeal Cerejeira,Lago do Monumento ao 25 de Abril de 1974,Lago,,259a03be-cf97-4fbd-97c4-e0efa1ba5ad2,0.0,0.0,,
5,-9.12964541750678,38.7097181289075,6,5202,4,Travessa do Chafariz de El-Rei,Depósito do Chafariz d'El Rey,Reservatório,,d215905f-3cdc-43e9-94ac-26ac79d0586f,0.0,0.0,,
6,-9.1452230848824,38.7178672592848,7,4510,4,Praça da Alegria,Lago do Jardim Alfredo Keil,Lago,,1b7fea54-bb11-49c4-9433-316e4b42fb81,0.0,0.0,,
7,-9.13384624250759,38.7159650139069,8,5301,4,Rua da Guia,Fontanário da Rua da Guia,Fontanário,,b5bd6eb1-1154-4ea5-8c76-9b4b486cc141,0.0,0.0,,
8,-9.15483988866377,38.7288785726626,9,5003,4,Parque Eduardo VII de Inglaterra,Lago da Estufa Fria,Lago,,a798949b-fa01-423b-ac0f-8f69a89acd2b,0.0,0.0,,
9,-9.19461199926588,38.7427400840742,10,804,4,"Travessa de Francisco Rezende, Quinta da Fonte",Lago da Quinta da Fonte,,,198299df-e885-4813-9524-03c48d61a21d,0.0,0.0,,
10,-9.1543454559314,38.7171117194583,11,4602,4,Rua do Arco a São Mamede,Chafariz da Rua do Arco a São Mamede,Chafariz,,e2929029-e067-4cc6-8350-480e561978d3,0.0,0.0,,
11,-9.15708436084216,38.7580263821765,12,906,4,Campo Grande,Lago 1 no Museu da Cidade,Lago,,72f2559d-c58f-4255-840f-8fcd19b939ae,0.0,0.0,,
12,-9.12256115585251,38.7158721081273,13,5107,4,Largo Dr. Bernardino António Gomes (Pai),Chafariz do Largo Dr. Bernardino António Gomes (Pai),Chafariz,,2b6d69ad-7205-40b8-b3d6-0d9568ce60f3,0.0,0.0,,
13,-9.14874997129918,38.7097001046763,14,4903,4,Rua de Santa Catarina,Fontanário na Rua de Santa Catarina,Fontanário,,0a6e1959-7be3-46ea-9ad5-6e03a979bb46,0.0,0.0,,
14,-9.12957851008613,38.7109962289977,15,4702,4,"Beco de São Miguel, Escadinhas de São Miguel",Chafariz das Escadinhas de São Miguel,Chafariz,,43e880f8-84b0-480d-882e-1a5eb547e5cd,0.0,0.0,,
15,-9.15939980980951,38.7824942499611,16,502,4,Largo do Ministro,Fontanário no Largo do Ministro,Fontanário,,9c76e2ea-fb8a-439c-bcbb-3baca1ea735c,0.0,0.0,,
16,-9.15570358467345,38.7212526459075,17,4604,4,Rua das Amoreiras,Reservatório da Mãe d'Água das Amoreiras,Reservatório,,a6ecbd4f-3a7f-42f4-9596-ae264108e643,0.0,0.0,,
17,-9.2009714166056,38.750460324748,18,805,4,Estrada de Benfica,Chafariz das Garridas ou de Benfica,Chafariz,,d140dae6-ae16-4b29-be8d-f218bd162dae,0.0,0.0,,
18,-9.12402019414711,38.7135065626157,19,5102,4,"Calçada do Forte, Rua dos Caminhos de Ferro",Bebedouro de Animais,Fontanário,,45cfed45-5b18-4187-aba0-b0f6cc5a83ef,0.0,0.0,,
19,-9.12805386423308,38.7153045089401,20,5104,4,Telheiro de São Vicente,Fontanário no Jardim João Lopes,Fontanário,,ee3d9c1b-d82d-45aa-85a9-b87cdd9036e3,0.0,0.0,,
20,-9.1776113582594,38.7331150103789,21,801,4,"Caminho Pedreiras, Parque Recreativo da Serafina",Lago do Barco do Parque Recreativo da Serafina,Lago,,c43375d1-94d1-43ac-943c-6215ba24ffd9,0.0,0.0,,
21,-9.21488603379403,38.7157245109877,22,4006,4,Rua do Gabarete,Fontanário da Rua do Gabarete,Fontanário,,da279ab5-25cb-4d73-a5a6-31f2e95bac7f,0.0,0.0,,
22,-9.13045495139306,38.7114796238739,23,4706,4,"Largo de Santa Luzia, (Miradouro)",Chafariz do Miradouro de Santa Luzia,Chafariz,,16826cfa-9d38-4bf3-bf69-2842b7a5de10,0.0,0.0,,
23,-9.20757799102269,38.7247687087755,24,812,4,"Estrada da Circunvalação, Parque de Campismo de Monsanto",Lago na entrada do Parque de Campismo de Monsanto,Lago,,aa29307f-cf42-4bfa-bb29-47000ea0b7c0,0.0,0.0,,
24,-9.12007685864609,38.7236070418795,25,4107,4,Alto Varejão,Chafariz do Alto do Varejão,Chafariz,,e42805c9-fd3f-41e0-aa06-ed6e8d043d86,0.0,0.0,,
25,-9.19098029293019,38.7496095276913,26,809,4,Avenida do Colégio Militar,Lago na Avenida do Colégio Militar,Lago,,054b4db3-255c-4df3-ae1b-c1d47b2932f2,0.0,0.0,,
26,-9.20228816265749,38.7489464325895,27,811,4,Alameda Padre Álvaro Proença,Lago na Alameda Padre Álvaro Proença,Lago,,356020ce-da54-4b7f-8407-da86de25b67b,0.0,0.0,,
27,-9.15625918549019,38.7220755061763,28,4603,4,"Praça das Amoreiras, Jardim Marcelino Mesquita",Lago do Jardim Marcelino Mesquita,Lago,,357f45c2-9014-431f-9f25-c08b65c7ae13,0.0,0.0,,
28,-9.15755453277369,38.7840298916134,29,503,4,Largo do Terreiro,Fontanário no Largo do Terreiro,Fontanário,,ac2beb87-981a-459f-9e7f-3ad944ac542e,0.0,0.0,,
29,-9.12512438802298,38.714304989958,30,5105,4,Calçada do Cascão,Fontanário na Calçada do Cascão,Fontanário,,5249cddd-c2c5-4bfb-957c-7b9ada39a524,0.0,0.0,,
30,-9.12821061216532,38.7150373322005,31,5101,4,"Largo de São Vicente, Arco Grande de Cima",Chafariz do Largo de São Vicente,Chafariz,,7d1432cc-cd5c-4b60-b101-d1be913d0c9f,0.0,0.0,,
31,-9.11919454864539,38.7300048486498,32,4106,4,Parada do Alto de São João,Lago 2 do Cemitério do Alto de São João,Lago,,4bae1643-3d67-4350-b9be-8c0c8194342a,0.0,0.0,,
32,-9.12948873155832,38.710147804963,33,4708,4,Rua da Judiaria,Chafariz da Rua da Judiaria,Chafariz,,d12c63ef-fe50-463d-90c8-18fe417fe36a,0.0,0.0,,
33,-9.13493205505612,38.7205809057875,34,601,4,"Largo do Intendente Pina Manique, Rua do Benformoso",Lago do Largo do Intendente Pina Manique,Lago,,9fdb6060-da26-4078-b62b-f7b495ddedc0,0.0,0.0,,
34,-9.19763560634134,38.7586045991383,35,864,4,Rua 19 do Cemitério de Benfica,Bica 35 no Cemitério de Benfica,Bica,,f0391bc4-79db-44d9-9266-5bd0fa970cbb,0.0,0.0,,
35,-9.19828312008299,38.758507947202,36,866,4,Rua 17 do Cemitério de Benfica,Bica 37 no Cemitério de Benfica,Bica,,7f9f3f2c-3ae4-4f84-b1f6-3c22209886f4,0.0,0.0,,
36,-9.1994688432574,38.7577430889421,37,869,4,Rua 3 do Cemitério de Benfica,Bica 40 no Cemitério de Benfica,Bica,,3898d596-499c-4613-bd70-dfe98e2e992a,0.0,0.0,,
37,-9.20532734651998,38.6969284487376,38,3223,4,Praça do Império,Bebedouro 1 do Jardim da Praça do Império,Bebedouro,,0e8b0af0-b8fc-4752-b7d2-8518382a8ae7,38.6969284487376,-9.20532734651998,BEBEDOURO,Bebedouro 1 do Jardim da Praça do Império - Praça do Império
38,-9.20481918573343,38.6956901406633,39,3224,4,Praça do Império,Bebedouro 2 do Jardim da Praça do Império,Bebedouro,,a14f8d61-a25e-4746-aa0a-2b48f8638ef0,38.6956901406633,-9.20481918573343,BEBEDOURO,Bebedouro 2 do Jardim da Praça do Império - Praça do Império
39,-9.20671303467665,38.69521411788,40,3225,4,Praça do Império,Bebedouro 3 do Jardim da Praça do Império,Bebedouro,,9347a1f0-abc9-45be-9a3c-7395ee4dc1cf,38.69521411788,-9.20671303467665,BEBEDOURO,Bebedouro 3 do Jardim da Praça do Império - Praça do Império
40,-9.20721605440484,38.6964506519805,41,3226,4,Praça do Império,Bebedouro 4 do Jardim da Praça do Império,Bebedouro,,fd3dd6a0-cb91-48c1-aa56-a2a6168dfefa,38.6964506519805,-9.20721605440484,BEBEDOURO,Bebedouro 4 do Jardim da Praça do Império - Praça do Império
41,-9.13381285212848,38.7125476504461,42,1243,4,Castelo de São Jorge,Fontanário 8,Fontanário,,8cf2420c-ea37-48b4-a9b6-82feacb38ffe,0.0,0.0,,
42,-9.19800913122637,38.708422205731,43,109,4,Calçada do Mirante à Ajuda,Chafariz na Calçada do Mirante à Ajuda,Chafariz,,2f0578d0-42b9-4c34-af1c-513f9b56b376,0.0,0.0,,
43,-9.1642903954214,38.7355869242249,44,1015,4,Jardim Amnistia Internacional,Bebedouro 1 no Jardim da Amnistia,Bebedouro,,0a1f36d4-634f-42b4-8c91-ea375567e600,38.7355869242249,-9.1642903954214,BEBEDOURO,Bebedouro 1 no Jardim da Amnistia - Jardim Amnistia Internacional
44,-9.16555337101534,38.7367299248602,45,1016,4,Jardim Amnistia Internacional,Bebedouro 2 no Jardim da Amnistia,Bebedouro,,07f6cb52-baf4-4840-8da4-81e7df0c2328,38.7367299248602,-9.16555337101534,BEBEDOURO,Bebedouro 2 no Jardim da Amnistia - Jardim Amnistia Internacional
45,-9.16734856607575,38.7366574501441,46,1018,4,Avenida General Correia Barreto(antiga Radial de Benfica),Bebedouro junto ao Parque Infantil da Quinta José Pinto,Bebedouro,,cd921b8b-8437-4d06-9026-05cb909ba2e5,38.7366574501441,-9.16734856607575,BEBEDOURO,Bebedouro junto ao Parque Infantil da Quinta José Pinto - Avenida General Correia Barreto(antiga Radial de Benfica)
46,-9.18623704629623,38.7738050479784,47,1130,4,Rua do Rio Zêzere(antiga Rua 7A do Bairro Padre Cruz),Bica 12 Cemitério de Carnide,Bica,,570f714a-4ca4-4d6c-bea7-335909d890b9,0.0,0.0,,
47,-9.18754436812244,38.7735550385413,48,1132,4,Rua do Rio Zêzere(antiga Rua 7A do Bairro Padre Cruz),Bica 14 Cemitério de Carnide,Bica,,26c1730b-ff19-48aa-b78f-d7f86926f2c5,0.0,0.0,,
48,-9.18541550373122,38.7749235825704,49,1136,4,Rua do Rio Zêzere(antiga Rua 7A do Bairro Padre Cruz),Bica 18 Cemitério de Carnide,Bica,,0b6f6f99-811f-40ae-ace7-d75993aedd48,0.0,0.0,,
49,-9.14791168234064,38.7771794950433,50,1312,4,Avenida Nuno Krus Abecassis(antiga Avenida 4 do Alto do Lumiar),"Furo de captação Parque Oeste, Vale Grande SS-01",Furo de captação,,6c48b8c0-b351-4544-80a2-030a91a98469,0.0,0.0,,
50,-9.14995893927991,38.7777435134852,51,1313,4,Alameda da Música(antigo Arrua. Inte. da Malha 15 - Alto do Lumiar),"Furo de captação Parque Oeste, Vale Grande SS-02",Furo de captação,,9461a647-12f5-4c12-a278-82eae763ec9f,0.0,0.0,,
51,-9.15389531643072,38.7806254465001,52,1314,4,Avenida Dr. José Salvado Sampaio,"Furo de captação Parque Oeste, Vale Grande SS-03",Furo de captação,,553ca965-dbcc-4f69-867b-89a73e772ada,0.0,0.0,,
52,-9.15752733178688,38.7772121549422,53,1878,4,Eixo Norte-Sul,"Furo de captação Parque Oeste, Vale Grande SS-04",Furo de captação,,7bc430f8-b33b-4f7c-a0ed-3a010d35eb05,0.0,0.0,,
53,-9.14882264680229,38.7727091398643,54,1316,4,Eixo Central(Alto do Lumiar),Furo de captação Eixo Central F2,Furo de captação,,507f6f56-c0bf-40d2-97e5-4f19002aa090,0.0,0.0,,
54,-9.09111872762133,38.7797058960243,55,3383,4,Passeio do Tejo,Bebedouro 8 do Parque Tejo,Bebedouro,,1a0b6945-77bc-46eb-b0c4-2f9eb60e472c,38.7797058960243,-9.09111872762133,BEBEDOURO,Bebedouro 8 do Parque Tejo - Passeio do Tejo
55,-9.18725099092707,38.743518877091,56,3933,4,Estrada do Barcal,Bebedouro 1 na Mata de São Domingos de Benfica,Bebedouro,,03170e0d-a9a4-4e9e-922c-c6ec07489d4d,38.743518877091,-9.18725099092707,BEBEDOURO,Bebedouro 1 na Mata de São Domingos de Benfica - Estrada do Barcal
56,-9.18719193388366,38.7438248750588,57,3937,4,Estrada do Barcal,Bebedouro junto à Parede de Escalada da Mata de São Domingos de Benfica,Bebedouro,,c41c6146-0a6e-4647-b9dd-d9f6297dc28c,38.7438248750588,-9.18719193388366,BEBEDOURO,Bebedouro junto à Parede de Escalada da Mata de São Domingos de Benfica - Estrada do Barcal
57,-9.1887902523698,38.7434772405046,58,3938,4,Estrada do Barcal,Bebedouro 3 na Mata de São Domingos de Benfica,Bebedouro,,26cb904e-c333-4385-ad6b-5dec59d9a696,38.7434772405046,-9.1887902523698,BEBEDOURO,Bebedouro 3 na Mata de São Domingos de Benfica - Estrada do Barcal
58,-9.09312326158398,38.7870426214852,59,3368,4,Caminho dos Rouxinóis,Furo de Captação- Luso Ponte PS1,Furo de captação,,6e33748c-c2c5-4aaf-962e-5b56cc25a76a,0.0,0.0,,
59,-9.09391095652739,38.7844694394749,60,3369,4,Passeio do Parque,Furo de Captação - Lote Hotel HS1,Furo de captação,,72ab5726-c6d1-4da3-894e-a75c19740a43,0.0,0.0,,
60,-9.09896220223461,38.7602336278781,61,3370,4,Cabeço das Rolas,"Furo de captação PN - Cabeço das Rolas, rua do Corsário das Ilhas",Furo de captação,,0ecf2d01-328b-4076-afc7-ac0d814308b0,0.0,0.0,,
61,-9.15015562181811,38.7519629365658,62,922,4,Campo Grande,Furo de captação Jardim do Campo Grande Sul ,Furo de captação,,6aeec56a-27a8-4b21-92cf-8f94ca9318b7,0.0,0.0,,
62,-9.15325863277817,38.7554365524896,63,923,4,Campo Grande,Furo de captação Jardim do Campo Grande Norte,Furo de captação,,9c28d62a-128e-43d0-82ef-e2c4904df041,0.0,0.0,,
63,-9.15480969359214,38.7297886785298,64,5019,4,Alameda Cardeal Cerejeira,"Furo de captação Estufa fria, Parque Eduardo VII",Furo de captação,,f2eab5dc-52c3-416c-9208-606f6f8e347e,0.0,0.0,,
64,-9.16772665170748,38.7108525408919,65,2619,4,Calçada das Necessidades,"Furo de captação Tapada das Necessidades, zona N",Furo de captação,,64d11661-e25b-47f2-bd65-c333a8b90769,0.0,0.0,,
65,-9.1079324705397,38.763838179301,66,3394,4,Rua 8 do Cemitério dos Olivais,Bica 9 no Cemitério dos Olivais,Bica,,27b53419-4760-4b98-a8ee-baa369859a89,0.0,0.0,,
66,-9.10823500516108,38.7638779142092,67,3395,4,Rua 10 do Cemitério dos Olivais,Bica 10 no Cemitério dos Olivais,Bica,,385588ce-a44f-4c9c-bba5-bd81294094d0,0.0,0.0,,
67,-9.1085155130917,38.7636201727531,68,3396,4,Rua 12 do Cemitério dos Olivais,Bica 11 no Cemitério dos Olivais,Bica,,901e6bcb-bbc5-4f9c-bc83-3ece7d3da5f5,0.0,0.0,,
68,-9.10855413256408,38.7639141958987,69,3397,4,Rua 12 do Cemitério dos Olivais,Bica 12 no Cemitério dos Olivais,Bica,,cbd6da57-3748-4be6-b136-90490bc49057,0.0,0.0,,
69,-9.10875177001143,38.7642973435067,70,33100,4,Rua 12 do Cemitério dos Olivais,Bica 14 no Cemitério dos Olivais,Bica,,78788642-965e-4a73-88f5-cc0800515a00,0.0,0.0,,
70,-9.17869858745115,38.7344698254734,71,817,4,Caminho Pedreiras,Bebedouro 1 no Parque Recreativo do Alto da Serafina,Bebedouro,,9a788e83-5cea-4869-b392-f42d1b81e9fa,38.7344698254734,-9.17869858745115,BEBEDOURO,Bebedouro 1 no Parque Recreativo do Alto da Serafina - Caminho Pedreiras
71,-9.17776504742811,38.7342719770087,72,818,4,Caminho Pedreiras,Bebedouro 2 no Parque Recreativo do Alto da Serafina,Bebedouro,,341abe1a-b234-4a07-885c-e0c454bb1748,38.7342719770087,-9.17776504742811,BEBEDOURO,Bebedouro 2 no Parque Recreativo do Alto da Serafina - Caminho Pedreiras
72,-9.17792469152882,38.7339227984701,73,819,4,Caminho Pedreiras,Bebedouro 3 no Parque Recreativo do Alto da Serafina,Bebedouro,,a18ec8dc-40ab-4012-867a-8245f3c4982d,38.7339227984701,-9.17792469152882,BEBEDOURO,Bebedouro 3 no Parque Recreativo do Alto da Serafina - Caminho Pedreiras
73,-9.17617675503888,38.7336912273836,74,820,4,Caminho Pedreiras,Bebedouro 4 no Parque Recreativo do Alto da Serafina,Bebedouro,,85229aca-ffb1-4024-844e-aff2744ab380,38.7336912273836,-9.17617675503888,BEBEDOURO,Bebedouro 4 no Parque Recreativo do Alto da Serafina - Caminho Pedreiras
74,-9.14318155110984,38.7177715236478,75,4507,4,Avenida da Liberdade,Lago Nascente-Sul da Avenida da Liberdade,Lago,,9008c1c5-2c41-44bd-b1e9-a2f29bc77b1a,0.0,0.0,,
75,-9.15371521948763,38.7573464983809,76,918,4,Campo Grande,Bebedouro 5 no Jardim do Campo Grande,Bebedouro,,f7cda3b1-463a-4472-9d12-040d331b0c71,38.7573464983809,-9.15371521948763,BEBEDOURO,Bebedouro 5 no Jardim do Campo Grande - Campo Grande
76,-9.13962667768039,38.7229438370872,77,2407,4,Campo dos Mártires da Pátria,Bebedouro junto do Parque Infantil do Jardim Braancamp Freire,Bebedouro,,5394ea64-a94a-4fde-806c-e4159d3e015b,38.7229438370872,-9.13962667768039,BEBEDOURO,Bebedouro junto do Parque Infantil do Jardim Braancamp Freire - Campo dos Mártires da Pátria
77,-9.14008801737602,38.7221852047908,78,2408,4,Campo dos Mártires da Pátria,Bebedouro no Jardim Braancamp Freire,Bebedouro,,e22c7e42-cf4e-4fbc-b557-c5a9da569985,38.7221852047908,-9.14008801737602,BEBEDOURO,Bebedouro no Jardim Braancamp Freire - Campo dos Mártires da Pátria
78,-9.13490268463792,38.7246420624304,79,602,4,Avenida Almirante Reis,Bebedouro no Jardim António Feijó,Bebedouro,,3ab25062-66e4-4fff-a89f-188418456ba0,38.7246420624304,-9.13490268463792,BEBEDOURO,Bebedouro no Jardim António Feijó - Avenida Almirante Reis
79,-9.13132039911758,38.7369487850231,80,4407,4,Alameda Dom Afonso Henriques,Bebedouro na Alameda Dom Afonso Henriques,Bebedouro,,b1a200eb-f339-47d3-b360-d0528f7cb5ab,38.7369487850231,-9.13132039911758,BEBEDOURO,Bebedouro na Alameda Dom Afonso Henriques - Alameda Dom Afonso Henriques
80,-9.1439403032331,38.7179768241799,81,4508,4,Avenida da Liberdade,"Lago Poente-Norte (""O Douro"") da Avenida da Liberdade",Lago,,322f281e-55d0-4759-8a0e-a2519ddfed24,0.0,0.0,,
81,-9.14495036534529,38.7434539145889,82,2306,4,Campo Pequeno,Bebedouro no Parque Infantil do Jardim Marquês de Marialva,Bebedouro,,c06d4833-d6cc-4a85-acb8-e5472efc06bb,38.7434539145889,-9.14495036534529,BEBEDOURO,Bebedouro no Parque Infantil do Jardim Marquês de Marialva - Campo Pequeno
82,-9.14357519915555,38.737801840657,83,2307,4,Avenida de António José de Almeida,Bebedouro no Parque Infantil do Jardim Gomes de Amorim,Bebedouro,,3f908da1-2462-44f0-9fd9-f73ab52f856e,38.737801840657,-9.14357519915555,BEBEDOURO,Bebedouro no Parque Infantil do Jardim Gomes de Amorim - Avenida de António José de Almeida
83,-9.09348345636852,38.7614693355653,84,3363,4,Passeio de Ulisses,Lago Ilha no Passeio de Ulisses,Lago,,20120ff9-0bae-411b-bb80-e274015a35b5,0.0,0.0,,
84,-9.12107704737498,38.7697605560275,85,3373,4,Avenida de Berlim,Bebedouro no Parque Urbano dos Olivais,Bebedouro,,3633de07-aa9c-472a-917f-fb3714a30a94,38.7697605560275,-9.12107704737498,BEBEDOURO,Bebedouro no Parque Urbano dos Olivais - Avenida de Berlim
85,-9.10878496186285,38.7723727453233,86,3374,4,Avenida Dr. Francisco Luís Gomes,Bebedouro junto ao Parque Infantil da Quinta Conde dos Arcos,Bebedouro,,4897420b-778b-462a-b8da-91c291ff9523,38.7723727453233,-9.10878496186285,BEBEDOURO,Bebedouro junto ao Parque Infantil da Quinta Conde dos Arcos - Avenida Dr. Francisco Luís Gomes
86,-9.18652738988087,38.7741639819734,87,1134,4,Rua do Rio Zêzere(antiga Rua 7A do Bairro Padre Cruz),Bica 16 Cemitério de Carnide,Bica,,be2aa993-a008-422e-a5f4-e47afa9bd828,0.0,0.0,,
87,-9.1881697195277,38.7733957281361,88,1137,4,Rua do Rio Zêzere(antiga Rua 7A do Bairro Padre Cruz),Bica 19 Cemitério de Carnide,Bica,,dd33be40-f126-4ffd-bd62-817a07941216,0.0,0.0,,
88,-9.14655519392229,38.7788542473101,89,1315,4,Eixo Central(Alto do Lumiar),Furo de captação Eixo Central F1,Furo de captação,,aef6a1ec-3645-450e-a932-786e570898c0,0.0,0.0,,
89,-9.12679291883169,38.7496547189758,90,2130,4,Avenida Dr. Arlindo Vicente(antiga Rua 1 da Zona N1 de Chelas),Bebedouro 2 no Parque da Belavista Central,Bebedouro,,390166e3-5865-4553-8327-bc7b425bf936,38.7496547189758,-9.12679291883169,BEBEDOURO,Bebedouro 2 no Parque da Belavista Central - Avenida Dr. Arlindo Vicente(antiga Rua 1 da Zona N1 de Chelas)
90,-9.12788141374969,38.7509265268154,91,2131,4,Avenida Dr. Arlindo Vicente(antiga Rua 1 da Zona N1 de Chelas),Bebedouro 3 no Parque da Belavista Central,Bebedouro,,ea4a06ca-c49c-48cc-9c8f-9b008f15ebd5,38.7509265268154,-9.12788141374969,BEBEDOURO,Bebedouro 3 no Parque da Belavista Central - Avenida Dr. Arlindo Vicente(antiga Rua 1 da Zona N1 de Chelas)
91,-9.12622195772196,38.7506235976817,92,2132,4,Avenida Dr. Arlindo Vicente(antiga Rua 1 da Zona N1 de Chelas),Bebedouro 4 no Parque da Belavista Central,Bebedouro,,96a071f5-9459-4fea-9f5d-7c79b6a171f8,38.7506235976817,-9.12622195772196,BEBEDOURO,Bebedouro 4 no Parque da Belavista Central - Avenida Dr. Arlindo Vicente(antiga Rua 1 da Zona N1 de Chelas)
92,-9.12509456665051,38.7507471791866,93,2133,4,Avenida Dr. Arlindo Vicente(antiga Rua 1 da Zona N1 de Chelas),Bebedouro 5 no Parque da Belavista Central,Bebedouro,,95f762c5-23da-41f6-943f-25353087b814,38.7507471791866,-9.12509456665051,BEBEDOURO,Bebedouro 5 no Parque da Belavista Central - Avenida Dr. Arlindo Vicente(antiga Rua 1 da Zona N1 de Chelas)
93,-9.1264430573679,38.7513357850103,94,2134,4,Avenida Dr. Arlindo Vicente(antiga Rua 1 da Zona N1 de Chelas),Bebedouro 6 no Parque da Belavista Central,Bebedouro,,0d589886-093b-41be-8abd-6157678f72d7,38.7513357850103,-9.1264430573679,BEBEDOURO,Bebedouro 6 no Parque da Belavista Central - Avenida Dr. Arlindo Vicente(antiga Rua 1 da Zona N1 de Chelas)
94,-9.11894352432071,38.7656501275929,95,3371,4,Parque do Vale do Silêncio,Bebedouro 1 no Parque do Vale do Silêncio,Bebedouro,,1a05bb57-bb29-4e09-8d0a-372f66d7b1cf,38.7656501275929,-9.11894352432071,BEBEDOURO,Bebedouro 1 no Parque do Vale do Silêncio - Parque do Vale do Silêncio
95,-9.11799946322907,38.7676222577558,96,3372,4,Parque do Vale do Silêncio,Bebedouro 2 no Parque do Vale do Silêncio,Bebedouro,,03c367e3-9361-4b1a-9a29-cb6bccb0e3e2,38.7676222577558,-9.11799946322907,BEBEDOURO,Bebedouro 2 no Parque do Vale do Silêncio - Parque do Vale do Silêncio
96,-9.18216174199175,38.7387000380745,97,3935,4,Estrada do Barcal,Furo de captação Parque Florestal de Monsanto - SP1,Furo de captação,,89dfe7c9-758e-49e4-b4bd-97211e727af1,0.0,0.0,,
97,-9.10710829591092,38.7445254022666,98,2125,4,Rua Pedro de Azevedo(antiga Rua C e Impasse C1 do Bairro da Prodac),Bebedouro na Quinta das Flores,Bebedouro,,bd4c36fc-da60-42dc-b929-33fdd2f21716,38.7445254022666,-9.10710829591092,BEBEDOURO,Bebedouro na Quinta das Flores - Rua Pedro de Azevedo(antiga Rua C e Impasse C1 do Bairro da Prodac)
98,-9.1054109965552,38.7466091757492,99,2126,4,Azinhaga do Vale Fundão,Bebedouro no Parque Infantil da Quinta das Flores,Bebedouro,,70e18118-0ba7-4c49-8b97-5fcfd5039614,38.7466091757492,-9.1054109965552,BEBEDOURO,Bebedouro no Parque Infantil da Quinta das Flores - Azinhaga do Vale Fundão
99,-9.18596884708161,38.7229590314613,100,243,4,Estrada do Alvito,Bebedouro no Parque de Merendas do Miradouro da Escarpa,Bebedouro,,9b3a09e0-4ac3-4c2b-be80-1b53ed7bbb2a,38.7229590314613,-9.18596884708161,BEBEDOURO,Bebedouro no Parque de Merendas do Miradouro da Escarpa - Estrada do Alvito
100,-9.16993226366503,38.7228679632868,101,1007,4,Avenida Engenheiro Duarte Pacheco,Fonte no Miradouro da Belaflor,Fonte,,2524d4f1-ec64-4452-ae9a-d99835968561,0.0,0.0,,
101,-9.17294052571879,38.7289024254268,102,1010,4,"Rua O do Bairro da Liberdade, junto ao 27-27A",Fontanário 1 na Vila Ferro ao Bairro da Liberdade,,,4820429f-aacd-4cea-a908-5903ba105bdd,0.0,0.0,,
102,-9.17137815062382,38.7306640390538,103,1008,4,Rua dos Arcos,Fontanário na Rua dos Arcos,,,607d93e1-aae8-4dce-92e4-c7a5cfd77c09,0.0,0.0,,
103,-9.17040209064343,38.7329844209976,104,1012,4,Escadinhas da Liberdade(antiga Rua D do Bairro da Liberdade),Fontanário das Escadinhas da Liberdade,,,f1d66647-9587-4eb9-8f06-13a679cf5a6a,0.0,0.0,,
104,-9.1702407217774,38.7344973047728,105,1013,4,"Rua B do Bairro da Liberdade, junto ao 99",Poço no Bairro da Liberdade,,,a1e62153-9154-461d-a05d-422f14ebbdbc,0.0,0.0,,
105,-9.13347093626335,38.7125552136913,106,1244,4,Castelo de São Jorge,Fontanário 9,Fontanário,,adbfaf97-ac46-4805-bc55-d397c39d5636,0.0,0.0,,
106,-9.13330380739969,38.7129612501349,107,1246,4,Castelo de São Jorge,Fontanário 11,Fontanário,,a0ccda78-728d-46fd-b815-f5205b361f6c,0.0,0.0,,
107,-9.13918973353294,38.7133674062361,108,3103,4,Praça D. Pedro IV,Fonte Sul da Praça Dom Pedro IV,Fonte,,ee11ef23-ac83-46ef-9252-e00cb31553f7,0.0,0.0,,
108,-9.13049095676796,38.7372885740122,109,301,4,Alameda Dom Afonso Henriques,Fonte Monumental,Fonte,,a767a0cb-1a6b-434e-bb87-698ee8ca6644,0.0,0.0,,
109,-9.21337115711972,38.6964216338423,110,3211,4,Rua Vila Correia,Lago dos Viveiros da Quinta de Vila Correia,Lago,,52eeb299-88f7-4826-a8e1-831201cffb1c,0.0,0.0,,
110,-9.16246812513834,38.7192223530181,111,3003,4,Travessa de Cima dos Quartéis,Fontanário na T ravessa de Cima dos Quartéis,,,f985f9b6-55ca-4581-a705-e7bca02651fe,0.0,0.0,,
111,-9.15066302173159,38.7389536786914,112,2305,4,Jardim Amélia Carvalheira,Bebedouro no Parque Infantil do Jardim Amélia Carvalheira,Bebedouro,,6b4fecc5-1e5a-436e-b43f-7f78e2f135d1,38.7389536786914,-9.15066302173159,BEBEDOURO,Bebedouro no Parque Infantil do Jardim Amélia Carvalheira - Jardim Amélia Carvalheira
112,-9.15486634225227,38.7433241281355,113,2310,4,Rua Augusto Abelaira(antiga Rua Projectada A à Rua Sousa Lopes),Bebedouro na Rua Augusto Abeleira,Bebedouro,,b7c74e50-f9b2-4bf0-893d-121d05d0b6e8,38.7433241281355,-9.15486634225227,BEBEDOURO,Bebedouro na Rua Augusto Abeleira - Rua Augusto Abelaira(antiga Rua Projectada A à Rua Sousa Lopes)
113,-9.19976522441909,38.6963886810745,114,3205,4,"Praça Afonso de Albuquerque, Jardim Afonso de Albuquerque",Lago Nascente Sul do Jardim Afonso de Albuquerque,Lago,,48a29fe3-f3bb-4220-aa8a-7468df485b1e,0.0,0.0,,
114,-9.17437271696281,38.7717279648417,115,1826,4,"Alameda Mahatma Gandhi, Quinta de São Cristóvão",Lago 2 na Quinta de São Cristóvão,Lago,,a81be357-d329-4bb2-9adb-fd31fc4b5ae2,0.0,0.0,,
115,-9.15051384929214,38.7276821666058,116,5015,4,Parque Eduardo VII de Inglaterra,Chafariz no Pq. Eduardo VII de Inglaterra,,,07acf367-015f-4c50-9dab-8c3c0abab92a,0.0,0.0,,
116,-9.15515727603007,38.7132477456079,117,1718,4,Rua da Imprensa à Estrela,Lago no Jardim da Residência Oficial do Primeiro Ministro,,,4af7b555-f6ad-4bc8-9138-1bff324fd761,0.0,0.0,,
117,-9.15509582856967,38.7128923366461,118,1719,4,Rua da Imprensa à Estrela,Fonte no Jardim da Residência Oficial do Primeiro Ministro,,,b11636d7-c8ed-4c35-9ac0-340beaeae4af,0.0,0.0,,
118,-9.13742705119761,38.7308217749182,119,4404,4,Rua de Pascoal de Melo,Bebedouro no Jardim Constantino,Bebedouro,,4289ba20-f61e-47d3-9b88-b156977c5a2d,38.7308217749182,-9.13742705119761,BEBEDOURO,Bebedouro no Jardim Constantino - Rua de Pascoal de Melo
119,-9.16854746753541,38.7603181717678,120,1875,4,Jardim Prof. António de Sousa Franco,Tanque da Esplanada - Telheiras,Tanque,,7a87af88-838d-4ccf-83d2-f7571e3006c0,0.0,0.0,,
120,-9.1480091450574,38.7253474789238,121,1403,4,Rua Camilo Castelo Branco,Bebedouro na Rua Camilo Castelo Branco,Bebedouro,,d3bc032f-25f3-47f0-95b2-ab11367e8e50,38.7253474789238,-9.1480091450574,BEBEDOURO,Bebedouro na Rua Camilo Castelo Branco - Rua Camilo Castelo Branco
